dataset_identifier;federated_dataset;title;description;themes;keywords;license;language;timezone;modified;data_processed;metadata_processed;publisher;reference;attributions;created;issued;creator;contributor;contact_name;contact_email;accrual_periodicity;spatial;temporal;granularity;data_quality;publisher_type;conforms_to;temporal_coverage_start_date;temporal_coverage_end_date;rights;rml_mapping;publizierende_organisation;geodaten_modellbeschreibung;tags;number_of_records;size_of_records_in_the_dataset_in_bytes;reuse_count;api_call_count;download_count;attachments_download_count;file_fields_download_count;popularity_score;visibility_domain_or_restricted;published;publishing_properties;update_frequency;domain0;access_rights;relation;url_dataset
100428;False;Geteilte Mikromobilität nach Bezirk, Wochentagesabschnitt und Monat;"<p>Der Datensatz zeigt die Verteilung von Fahrzeugen der Mikromobilitätsanbieter in Basel-Stadt, gegliedert nach Bezirk, Tagesabschnitten von drei Stunden jedes Wochentags und Monats. </p>

<p>Die Daten berücksichtigen Merkmale wie Fahrzeugtyp, Bauweise, Antriebsart und Reichweite des Fahrzeugs bei vollem Akku.</p>

<p>Die Berechnung des Datensatzes basiert auf den Daten zur aktuellen Verfügbarkeit 
<a href=""https://data.bs.ch/explore/dataset/100415/"" target=""_blank"">https://data.bs.ch/explore/dataset/100415/</a>, 
die alle 10 Minuten aktualisiert werden. </p><p>Für die Bezirke wird folgender Datensatz verwendet:  <a href=""https://data.bs.ch/explore/dataset/100039/"" target=""_blank"">https://data.bs.ch/explore/dataset/100039/</a></p>

<p>Eine Übersicht der Datensätze zur geteilten Mikromobilität findet man unter folgendem Link: <a href=""https://data.bs.ch/explore/?refine.tags=mikromobilitaet"" target=""_blank"">https://data.bs.ch/explore/?refine.tags=mikromobilitaet</a> </p>";Mobilität und Verkehr,Raum und Umwelt;Trottinett,Scooter,Velo,Sharing,Shared,E-Mobility,Mobility,Veloverleih,Verkehr;CC BY 4.0 + OpenStreetMap;de;Europe/Zurich;2025-06-01T06:29:18+02:00;2025-06-01T06:29:18+02:00;2025-06-29T06:03:35+02:00;Amt für Mobilität;;Geodaten Kanton Basel-Stadt;2025-01-31;2025-05-12;Amt für Mobilität;;Open Data Basel-Stadt;opendata@bs.ch;http://publications.europa.eu/resource/authority/frequency/DAILY;;2025-02-01/2025-05-31;;;;;2025-02-01T00:00:00+01:00;2025-05-31T00:00:00+02:00;NonCommercialAllowed-CommercialAllowed-ReferenceRequired;;Bau- und Verkehrsdepartement;;opendata.swiss,mikromobilitaet;123049;2112312639;0;966;739;0;0;2.5;domain;True;;;;;;https://data.bs.ch/explore/dataset/100428
100305;False;Tigermückenbekämpfung: Bekämpfungszone;Das Monitoring der Tigermücken basiert auf 3 Standpfeilern: a) Aktives Monitoring mittels Fallennetzwerk und regelmässigen Kontrollen der Fallen b) Passives Monitoring aufgrund von Meldungen aus der Bevölkerung c) Nachuntersuchungen bei Bedarf;Raum und Umwelt;Umweltschutz,Krankheit,Prävention;CC BY 4.0 + OpenStreetMap;de;;2025-06-29T07:05:18+02:00;2025-06-29T07:05:18+02:00;2025-06-29T07:05:18+02:00;Kantonales Laboratorium;"www.geo.bs.ch/tigermuecken; https://www.geocat.ch/geonetwork/srv/ger/catalog.search#/metadata/8d20b5ca-cb0f-47a8-a909-35446745177f";Geodaten Kanton Basel-Stadt;2021-07-22;2023-08-04;Bereich Gesundheitsschutz;;Open Data Basel-Stadt;opendata@bs.ch;http://publications.europa.eu/resource/authority/frequency/CONT;;;;;;;;;NonCommercialAllowed-CommercialAllowed-ReferenceRequired;;Gesundheitsdepartement;https://models.geo.bs.ch/Modellbeschreibungen/TI_Tigermueckenbekaempfung_KGDM_V2_0.pdf;opendata.swiss;1;79400;0;5172;7127;0;0;6.9;domain;True;;;;;;https://data.bs.ch/explore/dataset/100305
100249;False;Strassen und Wege: Kantonsstrassen Riehen und Bettingen;"Dieser Datensatz ist Teil des kantonalen Geodatenmodells des Kantons Basel-Stadt ""Strassen und Wege"" und stellt die Kantonsstrassen Riehen und Bettingen dar. <br>Weitere Daten zu ""Strassen und Wege"":<a href=""https://data.bs.ch/explore/?refine.tags=Strassen+und+Wege"">https://data.bs.ch/explore/?refine.tags=Strassen+und+Wege</a><br>
Die Kantonsstrassen Riehen und Bettingen zeigen die Kantonsstrassen in Riehen und Bettingen.";Geographie,Mobilität und Verkehr;Weg,Mobilität,Strassennetz,Strasse,Wegnetz;CC BY 4.0 + OpenStreetMap;de;;2025-06-29T07:04:55+02:00;2025-06-29T07:04:55+02:00;2025-06-29T07:04:55+02:00;Amt für Mobilität;"www.geo.bs.ch/strassenwege; https://www.geocat.ch/geonetwork/srv/ger/catalog.search#/metadata/1854ab2e-7a1d-4a93-bc67-95add757f283";Geodaten Kanton Basel-Stadt;2019-05-07;2022-12-23;Amt für Mobilität;;Open Data Basel-Stadt;opendata@bs.ch;http://publications.europa.eu/resource/authority/frequency/IRREG;;;;;;;;;NonCommercialAllowed-CommercialAllowed-ReferenceRequired;;Bau- und Verkehrsdepartement;https://models.geo.bs.ch/Modellbeschreibungen/MN_Mobilitaetsnetz_KGDM_V1_0.pdf;opendata.swiss,Strassen und Wege;13;33694;0;9108;8007;0;0;7.9;domain;True;;;;;;https://data.bs.ch/explore/dataset/100249
100164;False;Wasserstand Grundwasser;"<p>Der Datensatz enthält die Grundwasserstände in m ü. M. des kantonalen Grundwassermessnetzes. Es weist zur Zeit um die 80 Messstationen auf. Bei den Stationen, die mit einer Datenfernübertragung ausgerüstet sind, liegen tagesaktuelle Stundenwerte vor.</p><p>Jede Messstation ist mit der Katasternummer gemäss Bohrkataster des Kantons Basel-Stadt versehen (<a href=""https://data.bs.ch/explore/dataset/100182/"" target=""_blank"">https://data.bs.ch/explore/dataset/100182/</a>). Die Bohrungen sind auch auf MapBS unter dem Thema Geologie abrufbar (<a href=""http://www.geo.bs.ch/bohrkataster"" target=""_blank"">www.geo.bs.ch/bohrkataster</a>).</p><p>Weitere Informationen: <a href=""https://www.bs.ch/wsu/aue/abteilung-gewaesser-und-boden#grundwasser"" target=""_blank"">https://www.bs.ch/wsu/aue/abteilung-gewaesser-und-boden#grundwasser</a></p><div><br></div>";Raum und Umwelt;Pegel,Wasserstand,Wasser,Trinkwasser;CC BY 3.0 CH;de;Europe/Zurich;2025-06-29T07:25:36+02:00;2025-06-29T07:25:36+02:00;2025-06-29T07:25:36+02:00;Amt für Umwelt und Energie;https://www.bs.ch/wsu/aue;https://www.aue.bs.ch;2022-07-11;2022-07-11;Amt für Umwelt und Energie;;Open Data Basel-Stadt;opendata@bs.ch;http://publications.europa.eu/resource/authority/frequency/DAILY;;1976-03-29/2025-06-27;;;;;1976-03-29T00:00:00+01:00;2025-06-27T00:00:00+02:00;NonCommercialAllowed-CommercialAllowed-ReferenceRequired;;Departement für Wirtschaft, Soziales und Umwelt;;opendata.swiss,airflow--aue_grundwasser;16303081;6253977047;0;565191;11065;0;0;29.9;domain;True;;;;;;https://data.bs.ch/explore/dataset/100164
100383;False;Solarkataster: Dachkanten;"Die Klasse Dachkante ist ein wesentlicher Bestandteil des Geodatenmodells (KGDM) «Solarkataster» und beschreibt die Dachkanten der Gebäude, die in der Klasse Solarpotenzial erfasst sind. 
<br> Sämtliche Datensätze zu dem Produkt ""Solarkataster"": <a href=""https://data.bs.ch/explore/?refine.tags=solarkataster"" target=""_blank"">https://data.bs.ch/explore/?refine.tags=solarkataster</a>
<br>Diese Dachkanten repräsentieren die Übergangsbereiche zwischen den Dachflächen und den Gebäudefassaden und dienen als visuelle Referenz zur Unterstützung der Analyse und Bewertung des Solarpotenzials.
<br>Die Klasse Dachkante ist besonders nützlich für Fachleute, die sich mit der Planung und Bewertung von Solaranlagen beschäftigen. Sie dient als Grundlage für detaillierte Analysen und Entscheidungsprozesse in der solartechnischen Nutzung von Gebäuden.";Energie;Solarenergie,Solarkollektor;CC BY 4.0 + OpenStreetMap;de;;2025-06-29T07:11:49+02:00;2025-06-29T07:11:49+02:00;2025-06-29T07:11:49+02:00;Amt für Umwelt und Energie;"www.geo.bs.ch/solarkataster; https://www.geocat.ch/geonetwork/srv/ger/catalog.search#/metadata/7897d029-24a8-44ec-b9bd-1a9218ada788";Geodaten Kanton Basel-Stadt;2012-03-06;2024-08-15;Amt für Umwelt und Energie;;Open Data Basel-Stadt;opendata@bs.ch;http://publications.europa.eu/resource/authority/frequency/IRREG;;;;;;;;;NonCommercialAllowed-CommercialAllowed-ReferenceRequired;;Departement für Wirtschaft, Soziales und Umwelt;https://models.geo.bs.ch/Modellbeschreibungen/SX_Solarkataster_KGDM_V1_0.pdf;opendata.swiss,Solarkataster;453460;87967082;0;3390;4834;0;0;5.6;domain;True;;;;;;https://data.bs.ch/explore/dataset/100383
100172;False;Smarte Strasse: Fahrzeugdurchfahrten;"<p>Der Datensatz zeigt alle Durchfahrten von Fahrzeugen mit der dazugehörigen Zeitangabe.</p><p class="""" style=""font-family: sans-serif;""><span style=""font-weight: bolder;"">Weitere Informationen und Daten rund um das Projekt «Smarte Strasse» finden Sie unter den folgenden Links:</span></p><ul><li>Informationen zum Projekt «Smarte Strasse»: <a href=""https://www.bs.ch/medienmitteilungen/pd/2022-pilotprojekt-smarte-strasse-neue-technologien-im-test-fuer-die-stadt-von-morgen"" target=""_blank"">https://www.bs.ch/medienmitteilungen/pd/2022-pilotprojekt-smarte-strasse-neue-technologien-im-test-fuer-die-stadt-von-morgen</a> </li><li>Genaue Standorte aller Sensoren (inkl. dem Schallsensor, der die Fahrzeugdurchfahrten zählt): <a href=""https://data.bs.ch/explore/dataset/100114/"" target=""_blank"">https://data.bs.ch/explore/dataset/100114/</a> </li><li>Weitere Datensätze aus dem Projekt «Smarte Strasse»: <a href=""https://data.bs.ch/explore/?refine.tags=smarte+strasse"" target=""_blank"">https://data.bs.ch/explore/?refine.tags=smarte+strasse</a> </li></ul><p><b>Hinweis: Die Sensoren an der Gundeldingerstrasse wurden am 29.6.23 abmontiert. Es werden keine Daten mehr erhoben.</b><br></p><p>Änderungsprotokoll: <br>29.06.2023 - Aktualisierungsintervall von ""CONT"" auf ""NEVER"" geändert.<br></p>";Mobilität und Verkehr;Smarte Strasse,Auto,Verkehr,Verkehrszählung,Stau;CC BY 3.0 CH;de;Europe/Zurich;2024-02-29T15:22:14+01:00;2024-02-29T15:22:14+01:00;2025-06-29T21:00:38+02:00;Amt für Umwelt und Energie;;Amt für Umwelt und Energie;2022-01-18;2022-02-07;Amt für Umwelt und Energie;;Open Data Basel-Stadt;opendata@bs.ch;http://publications.europa.eu/resource/authority/frequency/NEVER;;2023-02-20/2023-06-27;;;;;2023-02-20T00:00:00+01:00;2023-06-27T00:00:00+02:00;NonCommercialAllowed-CommercialAllowed-ReferenceRequired;;Departement für Wirtschaft, Soziales und Umwelt;;smarte strasse,opendata.swiss,airflow—smarte_strasse_schall;587596;43290410;1;242031;4507;0;0;20.5;domain;True;;;;;;https://data.bs.ch/explore/dataset/100172
100093;False;Smarte Strasse: Luftqualität;"<p>Das <a href=""https://www.baselland.ch/politik-und-behorden/direktionen/bau-und-umweltschutzdirektion/lufthygiene"" target=""_blank"">Lufthygieneamt beider Basel</a> (LHA) testet im Projekt «Smarte Strasse» kosteneffiziente Mikrosensoren auf ihre Genauigkeit und Zuverlässigkeit. Der installierte Sensor vom Typ «Nubo» der Firma Sensirion AG ist in der Lage, die Konzentration verschiedener Schadstoffe in der Luft in Echtzeit zu ermitteln. Gemessen werden die Gehalte der Gase Stickstoffdioxid (NO2) und Ozon (O3), sowie die feinere Fraktion des Feinstaubs «PM2.5». Die Belastungen mit Stickstoffdioxid und Feinstaub werden hauptsächlich durch den motorisierten Verkehr und durch Heizungen verursacht. Ozon wird in der Atmosphäre aus den Vorläuferschadstoffen Stickstoffdioxid und flüchtigen organischen Stoffen (VOC) unter Sonneneinwirkung gebildet. Parallel wurden drei «Nubo»- Sensoren an den permanenten Messstationen des LHA am St. Johanns-Platz, an der Feldbergastrasse und auf der Autobahn A2 in der Hard installiert und gegen die Referenzmessgeräte des LHA verglichen. Diese Werte stehen ebenfalls auf OGD zur Verfügung: <a href=""https://data.bs.ch/explore/dataset/100178/"" target=""_blank"">https://data.bs.ch/explore/dataset/100178/</a><br>Weitere Informationen zur Luftqualität in der Region Basel sind auf <a href=""https://www.luftqualitaet.ch"" target=""_blank"">www.luftqualitaet.ch</a>
 verfügbar. Hintergrundinformationen zu Ozon und Feinstaub auf den Webseiten <a href=""https://ozon-info.ch/"" target=""_blank"">www.ozon-info.ch</a> und <a href=""https://feinstaub.ch/"" target=""_blank"">www.feinstaub.ch</a>. Angaben zu den gesundheitlichen Auswirkungen der Luftverschmutzung auf der Webseite <a href=""https://www.swisstph.ch/de/projects/ludok/healtheffects/"" target=""_blank"">https://www.swisstph.ch/de/projects/ludok/healtheffects/</a>.</p><p>Die Maximalwerte (O3) und Mittelwerte (NO2, PM 2.5) des Vortages sind unter folgendem Datensatz zu finden: <a href=""https://data.bs.ch/explore/dataset/100174/"" target=""_blank"">https://data.bs.ch/explore/dataset/100174/</a> </p><p class="""" style=""font-family: sans-serif;""><span style=""font-weight: bolder;"">Weitere Informationen und Daten rund um das Projekt «Smarte Strasse» finden Sie unter den folgenden Links:</span></p><ul><li>Weitere Informationen zum Projekt «Smarte Strasse»: <a href=""https://www.bs.ch/medienmitteilungen/pd/2022-pilotprojekt-smarte-strasse-neue-technologien-im-test-fuer-die-stadt-von-morgen"" target=""_blank"">https://www.bs.ch/medienmitteilungen/pd/2022-pilotprojekt-smarte-strasse-neue-technologien-im-test-fuer-die-stadt-von-morgen</a> </li><li>Genaue Standorte aller Sensoren: <a href=""https://data.bs.ch/explore/dataset/100114/"" target=""_blank"">https://data.bs.ch/explore/dataset/100114/</a> </li><li>Weitere Datensätze rund um das Thema «Smarte Strasse»: <a href=""https://data.bs.ch/explore/?refine.tags=smarte+strasse"" target=""_blank"">https://data.bs.ch/explore/?refine.tags=smarte+strasse</a> </li></ul><p><b>Hinweis:<br>Die Luft-Sensoren an der Gundeldingerstrasse wurden am 29.6.23 abmontiert. Seit Anfang/Mitte Juni wurden keine Daten mehr erhoben.</b><br></p>";Raum und Umwelt;Smarte Strasse,Luftqualität,Feinstaub,PM2.5,O3,NO2;CC BY 3.0 CH;de;Europe/Zurich;2023-06-29T09:45:17+02:00;2023-06-29T09:45:17+02:00;2025-06-29T21:01:05+02:00;Lufthygieneamt beider Basel;;Lufthygieneamt beider Basel;2022-01-11;2022-02-07;Lufthygieneamt beider Basel;;Open Data Basel-Stadt;opendata@bs.ch;http://publications.europa.eu/resource/authority/frequency/NEVER;;2022-01-24/2023-06-29;;;;;2022-01-24T00:00:00+01:00;2023-06-29T00:00:00+02:00;NonCommercialAllowed-CommercialAllowed-ReferenceRequired;;Departement für Wirtschaft, Soziales und Umwelt;;smarte strasse,opendata.swiss,airflow—smarte_strasse_luft;20303;2430229;2;60420;3920;0;0;13.3;domain;True;;;;;;https://data.bs.ch/explore/dataset/100093
100049;False;Luftqualität Station St. Johannplatz;"<p>Standortbeschreibung: Die Messstation befindet sich in Basel auf dem St.Johannplatz, einem kleinen Park am Rande der Altstadt. Sie wird lokal beeinflusst durch eine mässig befahrene Strasse und Parkplatzsuchverkehr. 500m nördlich verläuft eine stark befahrene Strasse und in dieser Richtung liegt auch ein Teil der Chemischen Industrie. Die Station Basel St.Johannplatz gibt die Belastung wieder, wie sie als Hintergrund überall in der Stadt Basel anzutreffen ist.</p>Lage: Stadtzentrum in Park, offene Bebauung<p>Koordinaten: 2610790 / 1268370 bzw. N 47° 33.957 E 7° 34.921; 260 m ü. M.Geografische Lage: Juranordfuss</p><p>Siedlungsgrösse: 166'600 Einwohner</p><p>Verkehr, DTV (% LKW): &lt; 9'100 / 32'000 (8%)</p><p>Strassenabstand: 2 m / 500</p>";Raum und Umwelt,Gesundheit,Tourismus;Luft,Feinstaub,Ozon,Echtzeit,Realtime,Stickstoffdioxid,Stickoxid;CC BY 3.0 CH;de;UTC;2025-06-29T20:16:24+02:00;2025-06-29T20:16:24+02:00;2025-06-29T21:01:32+02:00;Lufthygieneamt beider Basel;"https://luftqualitaet.ch/messnetz/station/bsBSJ; https://www.baselland.ch/politik-und-behorden/direktionen/bau-und-umweltschutzdirektion/lufthygiene/lufthygiene/luftqualitat; https://luftqualitaet.ch/";;2019-11-06;2019-11-06;Lufthygieneamt beider Basel;;Open Data Basel-Stadt;opendata@bs.ch;http://publications.europa.eu/resource/authority/frequency/HOURLY;;2000-01-01/2025-06-28;;;;;2000-01-01T00:00:00+01:00;2025-06-28T00:00:00+02:00;NonCommercialAllowed-CommercialAllowed-ReferenceRequired;;Departement für Wirtschaft, Soziales und Umwelt;;airflow--luftqualitaet_ch,opendata.swiss;222725;27761160;1;60064;9572;0;0;14.2;domain;True;;;;;;https://data.bs.ch/explore/dataset/100049
100245;False;Effektiver und erwarteter täglicher Stromverbrauch;"Dieser Datensatz beinhaltet den täglichen Stromverbrauch sowie den mittels eines Modells berechneten, anhand des Kalendertages und der Witterung zu erwartenden Stromverbrauch.<br>Der Stromverbrauch ist die Summe der elektrischen Energie, die im Kanton Basel-Stadt täglich aus dem Netz bezogen wird, inklusive Netzverluste. Der tägliche Stromverbrauch ergibt sich als Summe des viertelstündlich ausgewiesenen Stromverbrauchs im OGD-Datensatz ""Kantonaler Stromverbrauch"" (<a href=""https://data.bs.ch/explore/dataset/100233/"">https://data.bs.ch/explore/dataset/100233/</a>).<br><br>Der Code des Modells kann selber ausgeführt und weiterentwickelt werden. Hierfür wird Renku verwendet. Renku ist eine Plattform, die verschiedene Werkzeuge für reproduzierbare und kollaborative Datenanalyseprojekte bündelt:<a href=""https://renkulab.io/projects/statabs/reproducible-research/erwarteter-stromverbrauch-basel-stadt"">https://renkulab.io/projects/statabs/reproducible-research/erwarteter-stromverbrauch-basel-stadt</a>";Energie;Strom,Stadtlast,Netzlast,Elektrizität,Elektro,Watt,Kilowattstunden,Stromverbrauch;CC BY 3.0 CH;de;Europe/Zurich;2025-06-29T21:15:43+02:00;2025-06-29T21:15:43+02:00;2025-06-29T21:15:43+02:00;Statistisches Amt;https://statistik.bs.ch/unterthema/4#Stromverbrauch;;2022-12-21;2023-02-16;Statistisches Amt;;Open Data Basel-Stadt;opendata@bs.ch;http://publications.europa.eu/resource/authority/frequency/WEEKLY;;;;;;;;;NonCommercialAllowed-CommercialAllowed-ReferenceRequired;;Präsidialdepartement;;opendata.swiss;4922;482151;5;81218;6502;0;0;18.5;domain;True;;;;;;https://data.bs.ch/explore/dataset/100245
100269;False;Temperatur Wiese;"<p>Der Datensatz zeigt die stündlichen Temperaturwerte der Wiese an.</p><p>Koordinaten: <a href=""https://map.geo.bs.ch/?lang=de&amp;baselayer_ref=Grundkarte%20farbig&amp;map_x=2611543&amp;map_y=1270112&amp;map_zoom=8&amp;rl_features=Fp(fjytj-wy78T~n*Standort'c*%2523DB4436'a*0'o*0.2'm*false'b*false's*14'k*2)"" target=""_blank"">47.581638577259945, 7.59193858146811</a></p>";Raum und Umwelt;Fluss;CC BY 3.0 CH;de;;2025-06-29T21:30:12+02:00;2025-06-29T21:30:12+02:00;2025-06-29T21:30:50+02:00;Tiefbauamt;;;2023-04-04;2023-05-15;;;Open Data Basel-Stadt;opendata@bs.ch;http://publications.europa.eu/resource/authority/frequency/HOURLY;;2023-01-24/2025-06-28;;;;;2023-01-24T00:00:00+01:00;2025-06-28T00:00:00+02:00;NonCommercialAllowed-CommercialAllowed-ReferenceRequired;;Bau- und Verkehrsdepartement;;BachApp,opendata.swiss;20826;717784;0;476824;5865;0;0;26.4;domain;True;;;;;;https://data.bs.ch/explore/dataset/100269
100293;False;Überwachung Luftqualität Transformation Areal Rosental: Standorte;"<p>Bedingt durch die frühere Nutzung des Rosental Areals – auch bekannt als die Wiege der Basler Chemie - ist der Untergrund mit Schadstoffen belastet. Während der Tiefbauarbeiten im Rahmen der «Transformation <a href=""https://rosentalmitte.ch/"" target=""_blank"">Rosental Mitte</a>» überwacht das <a href=""https://www.baselland.ch/politik-und-behorden/direktionen/bau-und-umweltschutzdirektion/lufthygiene"" target=""_blank"">Lufthygieneamt beider Basel (LHA)</a> die Immissionen mittels Messungen der Luft <a href=""https://data.bs.ch/pages/rosental-dashboard/"" target=""_blank"">(Dashboard)</a>. </p><p>Änderungsprotokoll:<br>23.4.2024: Die Messstation ROSEN 3 wurde verschoben. Alte geografische Breiten- und Längengrade 47.567827676637364, 7.603804744961502. Neue Breiten- und Lägengrade 47.567997530870265, 7.60479830196066.</p><div><br></div>";Raum und Umwelt;Luftqualität;CC BY 3.0 CH;de;;2025-06-25T16:00:10+02:00;2025-06-25T16:00:10+02:00;2025-06-29T22:00:18+02:00;Lufthygieneamt beider Basel;https://www.baselland.ch/politik-und-behorden/direktionen/bau-und-umweltschutzdirektion/lufthygiene;;2023-10-09;2023-10-09;Lufthygieneamt beider Basel;;Open Data Basel-Stadt;opendata@bs.ch;http://publications.europa.eu/resource/authority/frequency/IRREG;;;;;;;;;NonCommercialAllowed-CommercialAllowed-ReferenceRequired;;Departement für Wirtschaft, Soziales und Umwelt;;transformation-rosental,opendata.swiss;4;402;0;14755;5011;0;0;7.7;domain;True;scheduled;;;;;https://data.bs.ch/explore/dataset/100293
100345;False;Abstimmungen Details;"<p>Dieser Datensatz zeigt die Resultate aller Volksabstimmungen seit dem 27. September 2020 für den Kanton Basel-Stadt auf Ebene Wahllokal.</p><p>Bitte beachten Sie, dass die offiziell gültigen Schlussresultate im <a href=""https://www.kantonsblatt.ch/#!/search/publications"" target=""_blank"">Kantonsblatt</a> (<a href=""https://www.kantonsblatt.ch/#!/search/publications"" target=""_blank"">https://www.kantonsblatt.ch/#!/search/publications</a>) des Kantons Basel-Stadt publiziert werden.</p><p>Die Gesamtresultate der Abstimmungen und die Resultate auf Gemeindeebene findet man im Datensatz <a href=""https://data.bs.ch/explore/dataset/100346//"" target=""_blank"">""Abstimmungen Kennzahlen""</a> (<a href=""https://data.bs.ch/explore/dataset/100346/"" target=""_blank"">https://data.bs.ch/explore/dataset/100346/</a>)</p><p>Eine Liste der Wahllokale findet man im Datensatz ""<a href=""https://data.bs.ch/explore/dataset/100098//"" target=""_blank"">Wahllokale Kanton Basel-Stadt</a>"" (<a href=""https://data.bs.ch/explore/dataset/100098/"" target=""_blank"">https://data.bs.ch/explore/dataset/100098/</a>)</p>";Politik;Wahlen,Abstimmung,Demokratie,Teilhabe;CC BY 3.0 CH;de;Europe/Zurich;2025-05-18T17:58:09+02:00;2025-05-18T17:58:09+02:00;2025-06-29T22:00:32+02:00;Staatskanzlei;https://www.bs.ch/regierungsrat/staatskanzlei/politische-rechte/wahlen-und-abstimmungen;;2024-01-28;2024-06-08;Staatskanzlei des Kantons Basel-Stadt;;Open Data Basel-Stadt;opendata@bs.ch;http://publications.europa.eu/resource/authority/frequency/IRREG;;;;;;;2020-09-27T00:00:00+02:00;;NonCommercialAllowed-CommercialAllowed-ReferenceRequired;;Präsidialdepartement;;Airflow--staka_abstimmungen,opendata.swiss,Alle-Abstimmungen;632;175594;0;32004;2205;0;0;8.3;domain;True;;;;;;https://data.bs.ch/explore/dataset/100345
100113;False;Feinstaubmessungen auf BVB-Trams;"<p>Der Datensatz zeigt die Feinstaubmessungen (PM2.5 und PM10) vom Dach der BVB-Trams, auf denen Mikrosensoren installiert worden sind. Ein Sensor war jeweils auf einem Tram des Typs ""Flexity lang"" montiert, ausser die Sensoren 236 und 240, die zu Qualitätssicherungszwecken stationär an den Luftmessstationen ""Feldbergstrasse"" und ""St. Johann-Platz"" installiert waren.</p><p>

Die Messkampagne startete im Dezember 2019 und endete im März 2020. Es werden nachträglich keine weiteren Messdaten dazukommen und der Datensatz wird nicht mehr aktualisiert.
</p><p></p><p>
Weitere Informationen zum Projekt Atmo-VISION sind in der <a href=""https://www.bs.ch/medienmitteilungen/wsu/2020-atmovision-luftmessungen-auf-basler-tramlinien"" target=""_blank"">Medienmitteilung</a> und auf der Website des <a href=""https://www.baselland.ch/politik-und-behorden/direktionen/bau-und-umweltschutzdirektion/lufthygiene/lufthygiene/luftqualitat/atmovision-projekte"" target=""_blank"">Lufthygieneamt beider Basel</a> zu finden. Den Bericht des Projektes gibt es <a href=""https://www.baselland.ch/politik-und-behorden/direktionen/bau-und-umweltschutzdirektion/lufthygiene/lufthygiene/luftqualitat/atmovision-projekte/downloads-1/2020-11.pdf/@@download/file/2020-11-02_LHA_AtmoVision_Bericht_Feinstaubmesssungen_Tram.pdf"" target=""_blank"">hier</a> als PDF-Datei.</p><p>Änderungsprotokoll:<br>27.06.2023 - Aktualisierungsintervall von ""IRREG"" auf ""NEVER"" geändert.</p><p></p>";Raum und Umwelt,Mobilität und Verkehr;Luftqualität,Feinstaub,PM10,PM2.5,BVB;CC BY 3.0 CH;de;Europe/Zurich;2021-02-10T17:50:00+01:00;2021-02-10T17:50:00+01:00;2025-02-20T12:46:36+01:00;Lufthygieneamt beider Basel;https://www.baselland.ch/politik-und-behorden/direktionen/bau-und-umweltschutzdirektion/lufthygiene/lufthygiene/luftqualitat/atmovision-projekte#ftw-simplelayout-textblock-1;;2021-01-22;2021-02-10;Lufthygieneamt beider Basel;;Open Data Basel-Stadt;opendata@bs.ch;http://publications.europa.eu/resource/authority/frequency/NEVER;;2019-11-30/2020-03-24;;;;;2019-11-30T00:00:00+01:00;2020-03-24T00:00:00+01:00;NonCommercialAllowed-CommercialAllowed-ReferenceRequired;;Departement für Wirtschaft, Soziales und Umwelt;;opendata.swiss;933434;105463498;0;63012;5764;0;0;12.2;domain;True;;;;;;https://data.bs.ch/explore/dataset/100113
100392;False;Kandidierende der Grossratswahlen nach Alter, Geschlecht und Liste seit 2020;"<p style="""">Dieser Datensatz zeigt die Kandidierenden der Grossratswahlen nach Altersgruppe, amtlichen Geschlecht und Liste seit 2020<br></p>";Politik,Gesetzgebung,Verwaltung;Wahlen,Abstimmung,Demokratie,Teilhabe,Gesamterneuerungswahl;CC BY 3.0 CH;de;;2024-08-30T09:08:33+02:00;2024-08-30T09:08:33+02:00;2025-02-20T12:47:40+01:00;Statistisches Amt;https://statistik.bs.ch/unterthema/25;;2024-08-21;2024-08-26;Staatskanzlei des Kantons Basel-Stadt;;Open Data Basel-Stadt;opendata@bs.ch;http://publications.europa.eu/resource/authority/frequency/NEVER;;;;;;;;;NonCommercialAllowed-CommercialAllowed-ReferenceRequired;;Präsidialdepartement;;opendata.swiss,hintergrundinfo_gr24;372;31093;0;15913;1985;0;0;6.5;domain;True;;;;;;https://data.bs.ch/explore/dataset/100392
