dataset_identifier;federated_dataset;title;description;themes;keywords;license;language;timezone;modified;data_processed;metadata_processed;publisher;reference;attributions;created;issued;creator;contributor;contact_name;contact_email;accrual_periodicity;spatial;temporal;granularity;data_quality;publisher_type;conforms_to;temporal_coverage_start_date;temporal_coverage_end_date;rights;rml_mapping;publizierende_organisation;geodaten_modellbeschreibung;tags;number_of_records;size_of_records_in_the_dataset_in_bytes;reuse_count;api_call_count;download_count;attachments_download_count;file_fields_download_count;popularity_score;visibility_domain_or_restricted;published;publishing_properties;update_frequency;domain0;access_rights;relation;url_dataset
100201;False;Liegenschaften: Parzellen;Der Datensatz beinhaltet alle Liegenschaften des Kantons. Es wird zwischen Liegenschaft und Allmendparzelle unterschieden.;Geographie,Raum und Umwelt;amtliche-vermessung-av,grundbuch;CC BY 4.0 + OpenStreetMap;de;;2025-06-29T07:04:53+02:00;2025-06-29T07:04:53+02:00;2025-06-29T07:04:53+02:00;Grundbuch- und Vermessungsamt;https://www.geocat.ch/geonetwork/srv/ger/catalog.search#/metadata/4fae686d-5ddf-4443-8bd4-ccb03cf98e76;Geodaten Kanton Basel-Stadt;1996-02-01;2022-10-03;Grundbuch- und Vermessungsamt;;Open Data Basel-Stadt;opendata@bs.ch;http://publications.europa.eu/resource/authority/frequency/CONT;;;;;;;;;NonCommercialAllowed-CommercialAllowed-ReferenceRequired;;Bau- und Verkehrsdepartement;;opendata.swiss;24422;29659417;0;43908;9846;0;0;12.1;domain;True;;;;;;https://data.bs.ch/explore/dataset/100201
100179;False;Temperatur Grundwasser;"<p>Der Datensatz enthält die Grundwassertemparturen in °C des kantonalen Grundwassermessnetzes. Es weist zur Zeit um die 80 Messstationen auf. Bei den Stationen, die mit einer Datenfernübertragung ausgerüstet sind, liegen tagesaktuelle Stundenwerte vor.</p><p>Jede Messstation ist mit der Katasternummer gemäss Bohrkataster des Kantons Basel-Stadt versehen (<a href=""https://data.bs.ch/explore/dataset/100182/"" target=""_blank"">https://data.bs.ch/explore/dataset/100182/</a>). Die Bohrungen sind auch auf MapBS unter dem Thema Geologie abrufbar (<a href=""http://www.geo.bs.ch/bohrkataster"" target=""_blank"">www.geo.bs.ch/bohrkataster</a>).</p><p>Weitere Informationen: <a href=""https://www.bs.ch/wsu/aue/abteilung-gewaesser-und-boden#grundwasser"" target=""_blank"">https://www.bs.ch/wsu/aue/abteilung-gewaesser-und-boden#grundwasser</a></p>";Raum und Umwelt;Wasser,Temperatur,Grundwasser,Wassertemperatur;CC BY 3.0 CH;de;Europe/Zurich;2025-06-29T07:25:34+02:00;2025-06-29T07:25:34+02:00;2025-06-29T07:25:34+02:00;Amt für Umwelt und Energie;https://www.bs.ch/wsu/aue;https://www.aue.bs.ch;2022-07-11;2022-07-11;Amt für Umwelt und Energie;;Open Data Basel-Stadt;opendata@bs.ch;http://publications.europa.eu/resource/authority/frequency/DAILY;;1983-01-01/2025-06-27;;;;;1983-01-01T00:00:00+01:00;2025-06-27T00:00:00+02:00;NonCommercialAllowed-CommercialAllowed-ReferenceRequired;;Departement für Wirtschaft, Soziales und Umwelt;;opendata.swiss,airflow--aue_grundwasser;11294088;4246239873;0;497171;11141;0;0;28.4;domain;True;;;;;;https://data.bs.ch/explore/dataset/100179
100067;False;Umweltanalyse Grundwasser;"<p style='font-family: -apple-system, BlinkMacSystemFont, ""Segoe UI"", Roboto, Helvetica, Arial, sans-serif; font-size: 12.495px;'>Der Datensatz enthält die Analysedaten der Grundwasser-Beprobungs-Kampagnen des Kantons Basel-Stadt seit dem Jahr 1993.  Es werden Konzentrationsangaben zu verschiedenen Inhalts- resp. Schadstoffen mit Bezug auf den Brunnennamen sowie der geographischen Koordinaten gemacht.</p><p style='font-family: -apple-system, BlinkMacSystemFont, ""Segoe UI"", Roboto, Helvetica, Arial, sans-serif; font-size: 12.495px;'><span style=""font-size: 12.495px;"">Weitere Informationen: <a href=""https://www.bs.ch/wsu/aue/abteilung-gewaesser-und-boden#oberflaechengewaesser-und-fischerei"" target=""_blank"">https://www.bs.ch/wsu/aue/abteilung-gewaesser-und-boden#oberflaechengewaesser-und-fischerei</a></span><br></p>";Raum und Umwelt;Wasserqualität,Fluss,Reserve,Chemie,Rüs,Messwert,Wassertemperatur;CC BY 3.0 CH;de;Europe/Zurich;2025-06-29T08:12:40+02:00;2025-06-29T08:12:40+02:00;2025-06-29T08:12:40+02:00;Amt für Umwelt und Energie;;;2020-04-06;2020-04-06;Amt für Umwelt und Energie;;Open Data Basel-Stadt;opendata@bs.ch;http://publications.europa.eu/resource/authority/frequency/DAILY;;;;;;;1993-07-19T00:00:00+02:00;;NonCommercialAllowed-CommercialAllowed-ReferenceRequired;;Departement für Wirtschaft, Soziales und Umwelt;;Airflow--aue_umweltlabor,opendata.swiss;318848;103703894;1;262914;9652;0;0;22.8;domain;True;;;;;;https://data.bs.ch/explore/dataset/100067
100158;False;Überwachung Luftqualität Sanierung Areal Walkeweg;"<div>Immobilien Basel-Stadt (IBS) erstellt auf dem Familiengarten Areal Walkeweg Nord in Basel eine Neubebauung mit Wohneigentum und Schule. Bereiche des Neubauprojektes sind im Kataster der belasteten Standorte des Kantons Basel-Stadt geführt. Es handelt sich dabei um eine ehemalige Kiesentnahmestelle (ab ca. 1892), welche in Etappen ab 1917 sukzessive wieder mit Abfall aufgefüllt wurde. Im Rahmen des Projekts ist eine Totalsanierung mit Bodenaustausch am Standort vorgesehen.</div><div>Neben behördlichen Auflagen und Schutzmassnahmen, welche während den baulichen Massnahmen im Untergrund eine Belastung der Umgebung (Schutz der Umwelt und Allgemeinbevölkerung) mindern sollen, sieht das Lufthygieneamt beider Basel (LHA) vor, während der relevanten baulichen Eingriffe die Immissionen mittels Messungen der Luft zu überwachen. Auf Basis der Ergebnisse der technischen Untersuchung des Areals wurde in erster Linie die Staubdeposition (mittels Bergerhoff-Methode) und flüchtige organische Stoffe (mittels Passivsammler) als zu überwachende Parameter ausgewählt. </div><div>Für die vorliegende Überwachung wurden Warn- und Interventionswerte festgelegt. Die Interventionswerte beruhen auf behördlichen Grenzwerten und toxikologischen Studien. Der Warnwert wurde bei jeweils 50 % des Interventionswertes festgelegt.</div><div><br></div><div>Änderungsprotokoll:<br>27.06.2023 - Aktualisierungsintervall von ""MONTHLY"" auf ""NEVER"" geändert.</div><div>
</div>";Raum und Umwelt;Luftqualität;CC BY 3.0 CH;de;;2022-10-04T12:00:53+02:00;2022-10-04T12:00:53+02:00;2025-06-29T12:02:31+02:00;Lufthygieneamt beider Basel;https://www.baselland.ch/politik-und-behorden/direktionen/bau-und-umweltschutzdirektion/lufthygiene;;2021-12-15;2021-12-15;Lufthygieneamt beider Basel;;Open Data Basel-Stadt;opendata@bs.ch;http://publications.europa.eu/resource/authority/frequency/NEVER;;;;;;;2021-02-04T00:00:00+01:00;2022-06-27T00:00:00+02:00;NonCommercialAllowed-CommercialAllowed-ReferenceRequired;;Departement für Wirtschaft, Soziales und Umwelt;;opendata.swiss;246;40814;0;31229;5496;0;0;9.7;domain;True;scheduled;;;;;https://data.bs.ch/explore/dataset/100158
100254;False;Tägliche Klimadaten der NBCN-Station Basel-Binningen;"<p>Tagesdaten der NBCN-Station (Swiss National Basic Climatological Network) Basel-Binningen der MeteoSchweiz. Komplette, <a href=""https://www.meteoschweiz.admin.ch/klima/klimawandel/entwicklung-temperatur-niederschlag-sonnenschein/homogene-messreihen-ab-1864/homogenisierung-von-klima-messreihen.html"" target=""_blank"">nicht homogenisierte</a>  Datenreihe der wichtigsten Tageswerte seit Messbeginn.</p><p> Methodischer Hinweis:<br>Die Berechnung des Tagesmittels der Lufttemperatur erfolgte je nach historischer Zeitperiode unterschiedlich. <br>Bis 1980 wurden die Temperaturwerte nur dreimal täglich erfasst, der Mittelwert basiert entsprechend auf diesen drei Ablesungen. Ab 1981 liegen Stundenmittel zugrunde und ab 2018 10min-Werte. Das tägliche Minimum und Maximum der Lufttemperatur wurde bis 1980 anhand von Minimum- bzw. Maximum-Thermometern erfasst.</p>";Raum und Umwelt;Niederschlag,Strahlung,Druck,Luftdruck,Sonne,Klimatologie,Klima,Temperatur,Lufttemperatur,Sonnenschein,Sonnenscheindauer,Wetter,Luftfeuchtigkeit,Atmosphäre;CC BY 3.0 CH;de;;2025-06-29T16:00:27+02:00;2025-06-29T16:00:27+02:00;2025-06-29T20:00:17+02:00;MeteoSchweiz;"https://www.meteoschweiz.admin.ch/wetter/messsysteme/bodenstationen/schweizer-klimamessnetz.html; https://opendata.swiss/de/dataset/klimamessnetz-tageswerte";MeteoSchweiz;2022-12-21;2023-02-10;Open Data Basel-Stadt;;Open Data Basel-Stadt;opendata@bs.ch;http://publications.europa.eu/resource/authority/frequency/DAILY;;1864-01-01/2025-06-27;;;;;1863-12-31T23:59:00+00:30;2025-06-27T00:00:00+02:00;NonCommercialAllowed-CommercialAllowed-ReferenceRequired;;Öffentliche Organe des Bundes und anderer Kantone;;;58984;3657311;1;225312;2085;0;0;18.7;domain;True;scheduled;;;;;https://data.bs.ch/explore/dataset/100254
100029;False;Schulstandorte (Gemeinde Basel);Die Karte zeigt die Schulstandorte (Kindergärten, Primar-, Sekundarschule, Gymnasium, Zentrum für Brückenangebote, Allgemeine Gewerbeschule, Fachmaturitätsschule, Spezialangebote sowie Tagesstrukturen, Sportplätze, Turnhallen ausserhalb von Schulstandorten und Schwimmhallen) der Gemeinde Basel.;Bildung, Wissenschaft,Bevölkerung,Geographie;Schule,Lernen,Schüler,Schülerinnen,Lehrer,Lehrerinnen;CC BY 4.0 + OpenStreetMap;de;;2025-06-29T20:35:27+02:00;2025-06-29T20:35:27+02:00;2025-06-29T20:35:27+02:00;Zentrale Dienste;"www.geo.bs.ch/schulstandorte-basel; https://www.geocat.ch/geonetwork/srv/ger/catalog.search#/metadata/baf5ae32-de1d-411d-8fee-1c4de41cdf39";Geodaten Kanton Basel-Stadt;2017-01-23;2024-10-15;Zentrale Dienste;;Open Data Basel-Stadt;opendata@bs.ch;http://publications.europa.eu/resource/authority/frequency/ANNUAL_2;;;;;;;;;NonCommercialAllowed-CommercialAllowed-ReferenceRequired;;Erziehungsdepartement;https://models.geo.bs.ch/Modellbeschreibungen/SC_SchulstandorteBasel_GGDM_V2_0.pdf;Schulstandorte,opendata.swiss;407;313455;0;16603;3359;0;0;7.3;domain;True;;;;;;https://data.bs.ch/explore/dataset/100029
100404;False;Velostadtplan;Der Velostadtplan zeigt dir passende Routen zu deinem Ziel und liefert Ideen, wohin du mit deinem Velo besonders gut fahren kannst. Er ist die elektronische Version der faltbaren Papierkarte, die im Buchhandel, bei Basel Tourismus, Pro Velo und Veloplus erhältlich ist.;Mobilität und Verkehr,Geographie,Tourismus;Velo,Fahrrad,Veloweg,E-Bike,Pedelec;CC BY 4.0 + OpenStreetMap;de;;2025-06-29T20:35:40+02:00;2025-06-29T20:35:40+02:00;2025-06-29T20:35:40+02:00;Amt für Mobilität;"www.geo.bs.ch/velostadtplan; https://www.geocat.ch/geonetwork/srv/ger/catalog.search#/metadata/92330bd4-1feb-41df-8245-9dea15bd6a00";Geodaten Kanton Basel-Stadt;2017-01-31;2025-03-03;Amt für Mobilität;;Open Data Basel-Stadt;opendata@bs.ch;http://publications.europa.eu/resource/authority/frequency/IRREG;;;;;;;;;NonCommercialAllowed-CommercialAllowed-ReferenceRequired;;Bau- und Verkehrsdepartement;https://models.geo.bs.ch/Modellbeschreibungen/VO_Velostadtplan_KGDM_V2_0.pdf;opendata.swiss;5794;8533569;0;8021;2624;0;0;5.6;domain;True;;;;;;https://data.bs.ch/explore/dataset/100404
100175;False;Smarte Strasse: Geschwindigkeitsmessungen;"<p>Der Datensatz zeigt Geschwindigkeit und Lautstärke von Fahrzeugen mit der dazugehörigen Zeitangabe. Aus Datenschutzgründen werden jeweils Gruppen von 20 Fahrzeugen gebildet, die Reihenfolge randomisiert, und nur nur jeweils Start- und Endzeitpunkt des jeweiligen Zeitintervalls angegeben. </p><p><b>Wichtig:</b> Die Geschwindigkeits-Werte vor dem 25.03.2022 um 11:35 Uhr sind nicht kalibriert. Je nach Fahrspur werden diese Werte daher um bis zu 40% zu tief angegeben. </p><p class="""" style=""font-family: sans-serif;""><b>Weitere Informationen und Daten rund um das Projekt «Smarte Strasse» finden Sie unter den folgenden Links:</b></p><ul><li>Weitere Informationen zum Projekt «Smarte Strasse»: <a href=""https://www.bs.ch/medienmitteilungen/pd/2022-pilotprojekt-smarte-strasse-neue-technologien-im-test-fuer-die-stadt-von-morgen"" target=""_blank"">https://www.bs.ch/medienmitteilungen/pd/2022-pilotprojekt-smarte-strasse-neue-technologien-im-test-fuer-die-stadt-von-morgen</a> </li><li>Genaue Standorte aller Sensoren: <a href=""https://data.bs.ch/explore/dataset/100114/"" target=""_blank"">https://data.bs.ch/explore/dataset/100114/</a> </li><li>Weitere Datensätze rund um das Thema «Smarte Strasse»: <a href=""https://data.bs.ch/explore/?refine.tags=smarte+strasse"" target=""_blank"">https://data.bs.ch/explore/?refine.tags=smarte+strasse</a> </li></ul><p style=""font-family: sans-serif;""><span style=""font-weight: bolder;"">Hinweis: Die Sensoren an der Gundeldingerstrasse wurden am 29.6.23 abmontiert. Es werden keine Daten mehr erhoben.</span></p><p style=""font-family: sans-serif; margin-bottom: 1em;"">Änderungsprotokoll:<br>29.06.2023 - Aktualisierungsintervall von ""CONT"" auf ""NEVER"" geändert.</p>";Mobilität und Verkehr;Smarte Strasse,Tempo,Lärm,Lautstärke,Auto;CC BY 3.0 CH;de;Europe/Zurich;2024-03-01T09:00:31+01:00;2024-03-01T09:00:31+01:00;2025-06-29T22:00:07+02:00;Amt für Umwelt und Energie;;Amt für Umwelt und Energie;2022-01-18;2022-02-07;Amt für Umwelt und Energie;;Open Data Basel-Stadt;opendata@bs.ch;http://publications.europa.eu/resource/authority/frequency/NEVER;;2022-02-01/2023-06-27;;;;;2022-02-01T00:00:00+01:00;2023-06-27T00:00:00+02:00;NonCommercialAllowed-CommercialAllowed-ReferenceRequired;;Departement für Wirtschaft, Soziales und Umwelt;;smarte strasse,opendata.swiss,airflow—smarte_strasse_schall;2350606;374700084;1;366830;4336;0;0;24.0;domain;True;;;;;;https://data.bs.ch/explore/dataset/100175
100274;False;Überwachung Luftqualität Transformation Areal Rosental: Staubgebundene Schadstoffe;"<p>Bedingt durch die frühere Nutzung des Rosental Areals – auch bekannt als die Wiege der Basler Chemie - ist der Untergrund mit Schadstoffen belastet. Während der Tiefbauarbeiten im Rahmen der «Transformation <a href=""https://rosentalmitte.ch/"" target=""_blank"">Rosental Mitte</a>» überwacht das <a href=""https://www.baselland.ch/politik-und-behorden/direktionen/bau-und-umweltschutzdirektion/lufthygiene"" target=""_blank"">Lufthygieneamt beider Basel (LHA)</a> die Immissionen mittels Messungen der Luft <a href=""https://data.bs.ch/pages/rosental-dashboard/"" target=""_blank"">(Dashboard)</a>. </p><p>Änderungsprotokoll:<br>23.4.2024: Die Messstation ROSEN 3 wurde verschoben. Alte geografische Breiten- und Längengrade 47.567827676637364, 7.603804744961502. Neue Breiten- und Lägengrade 47.567997530870265, 7.60479830196066.<br></p><div><br></div>";Raum und Umwelt;Luftqualität;CC BY 3.0 CH;de;;2025-06-25T15:30:30+02:00;2025-06-25T15:30:30+02:00;2025-06-29T22:00:04+02:00;Lufthygieneamt beider Basel;https://www.baselland.ch/politik-und-behorden/direktionen/bau-und-umweltschutzdirektion/lufthygiene;;2023-10-09;2023-10-09;Lufthygieneamt beider Basel;;Open Data Basel-Stadt;opendata@bs.ch;http://publications.europa.eu/resource/authority/frequency/MONTHLY;;;;;;;2023-10-09T00:00:00+02:00;;NonCommercialAllowed-CommercialAllowed-ReferenceRequired;;Departement für Wirtschaft, Soziales und Umwelt;;transformation-rosental,opendata.swiss;2152;224899;0;90742;3145;0;0;12.7;domain;True;scheduled;;;;;https://data.bs.ch/explore/dataset/100274
100089;False;Rhein Wasserstand, Pegel und Abfluss;"<p>Dieser Datensatz zeigt den Wasserstand und die Abflussmenge des Rheins in Basel auf der Kleinbasler Seite auf Höhe des Birs-Zuflusses. Es liegen aktuelle Werte alle 5 Minuten vor. Die Messungen werden im Auftrag des Bundesamts für Umwelt durchgeführt (siehe <a href=""https://www.hydrodaten.admin.ch/de/seen-und-fluesse/stationen-und-daten/2289"" target=""_blank"">https://www.hydrodaten.admin.ch/de/seen-und-fluesse/stationen-und-daten/2289</a>).</p>
<p>Der Pegel wird berechnet als [Wasserstand] - 240 m ü. M., siehe <a href=""https://port-of-switzerland.ch/hafenservice/pegel/"" target=""_blank"">https://port-of-switzerland.ch/hafenservice/pegel</a>. </p>";Raum und Umwelt;Rhein,Pegel,Wasserstand,Abflussmenge,Strömung,Wasser,Tiefe;CC0 1.0;de;Europe/Zurich;2025-06-29T22:00:14+02:00;2025-06-29T22:00:14+02:00;2025-06-29T22:00:34+02:00;Bundesamt für Umwelt BAFU;https://www.hydrodaten.admin.ch/de/seen-und-fluesse/stationen-und-daten/2289;Bundesamt für Umwelt, Hydrologische Daten und Vorhersagen;2020-06-25;2020-06-29;;;Open Data Basel-Stadt;opendata@bs.ch;http://publications.europa.eu/resource/authority/frequency/CONT;;2020-06-22/2025-06-29;;;;;2020-06-22T00:00:00+02:00;2025-06-29T00:00:00+02:00;NonCommercialAllowed-CommercialAllowed-ReferenceNotRequired;;Öffentliche Organe des Bundes und anderer Kantone;;Airflow--bafu_hydrodaten,BachApp;527618;33164736;1;4248690;3438;0;0;70.5;domain;True;;;;;;https://data.bs.ch/explore/dataset/100089
100014;False;Zeitreihe der Belegung öffentlicher Parkhäuser Basel;"<p>Stündlich aktualisierte Belegungsdaten der öffentlichen Parkhäuser der Stadt Basel, bezogen über das Parkleitsystem Basel (<a href=""https://www.parkleitsystem-basel.ch"" target=""_blank"">https://www.parkleitsystem-basel.ch</a>).</p><p>Historische Daten mit kleinerer zeitlicher Auflösung können auch über das API von ParkenDD bezogen werden, wie hier am Beispiel der Parkhäuser der Stadt Zürich beschrieben: <a href=""https://opendatazurich.github.io/parkendd-api//"" target=""_blank"">https://opendatazurich.github.io/parkendd-api//</a> (die Parkhäuser von Basel sind über diese URL abrufbar: <a href=""https://api.parkendd.de/Basel"" target=""_blank"">https://api.parkendd.de/Basel</a>). </p><p>Die Standorte der Parkhäuser sind in diesem Datensatz ersichtlich: <a href=""https://data.bs.ch/explore/dataset/100044/"" target=""_blank"">https://data.bs.ch/explore/dataset/100044/</a>.<a href=""https://data.bs.ch/explore/dataset/100044/"" target=""_blank""></a></p><p>Änderungsprotokoll:</p><p>14.08.2023 - Neue Spalte ""auslastungen"" wurde hinzugefügt.</p><p>28.11.2024 - Es gibt eine Lücke vom 21. Oktober 2024 bis zum 28. November 2024.</p><p>28.11.2024 - Centralbahnparking wurde zu Centralbahn umbenannt in den Spalten id, id2, name, title.</p>";Mobilität und Verkehr;Parkplatz,Parkhaus,Autos,Elektroautos,Frei,Echtzeit,Realtime;CC BY 3.0 CH;de;Europe/Zurich;2025-06-29T21:06:08+02:00;2025-06-29T21:06:08+02:00;2025-06-29T21:06:08+02:00;Parkhäuser Basel-Stadt;https://www.bs.ch/fd/ibs/parkhaeuser;Parkhäuser Basel-Stadt;2007-12-31;2019-11-05;Parkhäuser Basel-Stadt;;Open Data Basel-Stadt;opendata@bs.ch;http://publications.europa.eu/resource/authority/frequency/CONT;;2019-02-07/2025-06-29;;;;;2019-02-07T00:00:00+01:00;2025-06-29T00:00:00+02:00;NonCommercialAllowed-CommercialAllowed-ReferenceRequired;;Finanzdepartement;;Airflow--parkendd,opendata.swiss;852413;237023515;1;515608;10608;458;0;29.7;domain;True;;;;;;https://data.bs.ch/explore/dataset/100014
100084;False;Standorte Mess-Stationen Smart Climate Feinstaubmessungen;"<p>Standorte der Mess-Stationen für Feinstaub für den Datensatz «Smart Climate Feinstaubmessungen» <a href=""https://data.bs.ch/explore/dataset/100081/"" target=""_blank"">https://data.bs.ch/explore/dataset/100081/</a>.</p>";Raum und Umwelt;Luftqualität,Feinstaub,PM25,PM2.5;CC BY 3.0 CH;de;;2021-01-12T16:57:11+01:00;2021-01-12T16:57:11+01:00;2025-02-20T12:48:55+01:00;Lufthygieneamt beider Basel;;Lufthygieneamt beider Basel;2020-05-13;2020-05-13;Lufthygieneamt beider Basel;;Open Data Basel-Stadt;opendata@bs.ch;http://publications.europa.eu/resource/authority/frequency/IRREG;;;;;;;;;NonCommercialAllowed-CommercialAllowed-ReferenceRequired;;Departement für Wirtschaft, Soziales und Umwelt;;opendata.swiss;10;1255;0;116658;5100;0;0;14.8;domain;True;;;;;;https://data.bs.ch/explore/dataset/100084
100135;False;Coronavirus (Covid-19): Impfungen nach Altersgruppe;"<p>Dieser Datensatz zeigt die SARS-CoV-2-Impfungen, welche an Personen mit Wohnsitz im Kanton Basel-Stadt verabreicht wurden nach Altersklasse. </p><p>Anmerkung: Die geimpften Personen wohnen im Kanton Basel-Stadt, müssen aber nicht zwingend auch im Kanton Basel-Stadt geimpft worden sein. Aus diesem Grund unterscheiden sich die hier publizierten Zahlen auch von jenen im <a href=""https://data.bs.ch/explore/dataset/100111/"" target=""_blank"">Datensatz mit den im Kanton Basel-Stadt verabreichten Impfungen</a>. </p><p>Ab 2. Juli 2021 werden auch geimpfte Personen in der Altersklasse von 12 bis 15 Jahren gezeigt. 12- bis 15-Jährige konnten sich ab 28. Juni 2021 impfen lassen.</p><p>
Ab 5. August 2021 können dritte Impfungen in den Daten enthalten sein. Initial sind ausschliesslich immundefiziente Personen oder Personen mit Stammzellentransplantation zu einer dritten Impfung berechtigt. </p><p>Die Meldepflicht der COVID-Impfungen via VMDL Plattform des Bundes wurde per 1. Juli 2023 aufgehoben. Nach diesem Datum wurden Impfungen deshalb nicht mehr systematisch erfasst. Der vorliegende Datensatz zeigt deshalb Impfungen nur bis 1. Juli 2023.<br></p><p> </p>";Gesundheit;Impfung,SARS-CoV-2,Coronavirus,Corona,Vaccination,impfen,geimpft;CC BY 3.0 CH;de;;2024-01-04T09:42:54+01:00;2024-01-04T09:42:54+01:00;2025-02-20T12:51:55+01:00;Medizinische Dienste;https://www.bs.ch/gd;opendata.swiss;2021-06-03;2021-06-11;Medizinische Dienste;;Open Data Basel-Stadt;opendata@bs.ch;http://publications.europa.eu/resource/authority/frequency/NEVER;;;;;;;2020-12-28T00:00:00+01:00;2023-07-01T00:00:00+02:00;NonCommercialAllowed-CommercialAllowed-ReferenceRequired;;Gesundheitsdepartement;;Airflow--bag_coronavirus,opendata.swiss;18931;509387;0;28659;4465;0;0;9.0;domain;True;;;;;;https://data.bs.ch/explore/dataset/100135
100090;False;Standorte Mess-Stationen Smart Climate Schallpegelmessungen;"Der Datensatz zeigt die Standorte der Mess-Stationen für den Datensatz <a href=""https://data.bs.ch/explore/dataset/100087/"" target=""_blank"">«Smart Climate Schallpegelmessungen»</a>.";Raum und Umwelt;Lärm,Lautstärke,Belästigung;CC BY 3.0 CH;de;Europe/Zurich;2025-02-20T12:51:58+01:00;2025-02-20T12:51:58+01:00;2025-02-20T12:51:58+01:00;Amt für Umwelt und Energie;;;2020-06-25;2020-06-25;;;Open Data Basel-Stadt;opendata@bs.ch;http://publications.europa.eu/resource/authority/frequency/IRREG;;;;;;;;;NonCommercialAllowed-CommercialAllowed-ReferenceRequired;;Departement für Wirtschaft, Soziales und Umwelt;;opendata.swiss;2;220;0;12324;5000;0;0;7.4;domain;True;;;;;;https://data.bs.ch/explore/dataset/100090
100300;False;Resultate der Bürgergemeinderatswahlen 18. Juni 2023;"<p>Der vorliegende Datensatz beinhaltet Resultate der Bürgergemeinderatswahlen Basel vom 18. Juni 2023 auf Ebene der einzelnen Kandidierenden. Weitere Informationen zu den Wahlen sind hier zu finden: <a href=""https://bgbasel.ch/de/politische-organe/buergergemeinderat/wahlen2023.html"" target=""_blank"">https://bgbasel.ch/de/politische-organe/buergergemeinderat/wahlen2023.html</a><br></p>";Politik,Bevölkerung,Gesetzgebung;Wahlen,Bürgergemeinderat;CC BY 3.0 CH;de;;2025-04-28T09:47:13+02:00;2025-04-28T09:47:13+02:00;2025-04-28T09:47:13+02:00;Bürgergemeinde der Stadt Basel;;;2023-06-17;2023-06-17;Staatskanzlei des Kantons Basel-Stadt;;Open Data Basel-Stadt;opendata@bs.ch;http://publications.europa.eu/resource/authority/frequency/NEVER;;;;;;;;;NonCommercialAllowed-CommercialAllowed-ReferenceRequired;;Bürgergemeinde der Stadt Basel;;opendata.swiss,Wahlen-bg-2023;298;120392;1;33331;5238;0;0;10.8;domain;True;;;;;;https://data.bs.ch/explore/dataset/100300
100221;False;Swisslos-Sportfonds Basel-Stadt;<p>Der Datensatz „Swisslos-Sportfonds Basel-Stadt“ dokumentiert die Vergabe von Fördermitteln aus dem Swisslos-Sportfonds im Kanton Basel-Stadt. Die Mittel dienen der Unterstützung des Breitensports, der Förderung von Sportvereinen und -verbänden sowie der Realisierung von Projekten im Leistungssport.</p><p>Der Datensatz enthält Informationen zu den begünstigten Sportvereinen und Organisationen, den geförderten Projekten sowie den jeweiligen Förderbeträgen. Die Unterstützung reicht von Beiträgen für Vereinsaktivitäten über die Anschaffung von Sportmaterial bis hin zur Durchführung von Veranstaltungen und Investitionen in Sportanlagen.</p>;Kultur, Medien, Informationsgesellschaft, Sport;Sport,Förderung,Swisslos;CC BY 3.0 CH;de;Europe/Zurich;2025-04-22T15:53:36+02:00;2025-04-22T15:53:36+02:00;2025-04-22T15:53:36+02:00;Jugend, Familie und Sport;https://www.bs.ch/ed/jfs/sport/finanzielle-unterstuetzung-fuer-den-sport;;2024-12-02;2025-02-10;Jugend, Familie und Sport;;Open Data Basel-Stadt;opendata@bs.ch;;;2017-01-01/2023-12-31;;;;;2017-01-01T00:00:00+01:00;2023-12-31T00:00:00+01:00;NonCommercialAllowed-CommercialAllowed-ReferenceRequired;;Erziehungsdepartement;;opendata.swiss;1213;91123;0;2514;1247;0;0;3.5;domain;True;;;;;;https://data.bs.ch/explore/dataset/100221
